{
  "schemaVersion": 2,
  "scrollVersion": "1.0.0",
  "boxId": "hello-box",
  "modelId": "example-org-hello",
  "runtimeId": "hello-box-runtime",
  "version": "1.0.0",
  "sourceRevision": "example-hello-v1",
  "target": { "platform": "linux", "arch": "x86_64", "accelerator": "cpu" },
  "compatibility": { "minHostAppVersion": "1.0.0", "minRamGb": 1 },
  "pythonVersion": "3.11",
  "pixiVersion": "0.73.0",
  "condaDependencyLicenseAudit": "examples/hello-box/linux-x86_64-cpu/conda-licenses.json",
  "pythonEntryPoint": "venv/bin/python",
  "modelCacheSubdir": "model-cache/hello",
  "environment": {},
  "assetBaseUrl": "https://assets.example.org/boxes",
  "assets": [],
  "localFiles": [
    {
      "sourcePath": "examples/hello-box/linux-x86_64-cpu/entrypoint.py",
      "relativePath": "entrypoint.py",
      "sha256": "3dea550d406449ea5f425133a9d20cdd17a4977b2b9bdd6ae5454c7107177f9c"
    }
  ],
  "selfTest": { "imports": ["json", "sqlite3"], "files": ["entrypoint.py"] },
  "execution": { "kind": "python-script", "script": "entrypoint.py", "defaultArgs": [] }
}
